{
  "system_overview": "museum-audio-guide is a QR-triggered audio guide with multilingual tracks. It is built as a small focused system with QR Resolver at its core, supported by Track Streamer and Visit Analytics (privacy-first).",
  "recommended_language": {
    "language": "TypeScript",
    "confidence": "medium",
    "rationale": "TypeScript fits the QR-triggered audio guide with multilingual tracks workload on technical grounds.",
    "overridden_by_user": false
  },
  "quality_goals": [
    {
      "goal": "Correct output under normal failure modes",
      "driver": "core feature correctness"
    },
    {
      "goal": "Maintainable by one person",
      "driver": "solo team size"
    }
  ],
  "architecture_decisions": [
    {
      "title": "Use QR Resolver as the system core",
      "chosen_option": "QR Resolver",
      "confidence": "high",
      "rationale": "The QR-triggered audio guide with multilingual tracks hinges on this component working well.",
      "consequences": {
        "positive": [
          "Single place to harden the critical path"
        ],
        "negative": [
          "Core component becomes a bottleneck for change"
        ]
      },
      "ruled_out": [
        {
          "option": "Spreading the logic across services",
          "rejection_reason": "Operational overhead for a small system."
        }
      ]
    },
    {
      "title": "Run Visit Analytics (privacy-first) asynchronously",
      "chosen_option": "Background processing for Visit Analytics (privacy-first)",
      "confidence": "medium",
      "rationale": "Keeps the interactive path fast on modest hardware.",
      "consequences": {
        "positive": [
          "Responsive UI under load"
        ],
        "negative": [
          "Eventually-consistent side effects need messaging"
        ]
      },
      "ruled_out": [
        {
          "option": "Synchronous in-request processing",
          "rejection_reason": "Ties user latency to slow external work."
        }
      ]
    }
  ],
  "oss_components": [
    {
      "name": "SQLite",
      "version": "3.45",
      "purpose": "primary store",
      "why_selected": "single-node scale, zero ops",
      "do_not_build": true
    }
  ],
  "what_not_to_build": [
    "A custom database or queue",
    "A plugin system before there are users"
  ],
  "risk_flags": [
    {
      "risk": "External dependency outage stalls the async path",
      "severity": "medium",
      "mitigation": "Retry with backoff and a dead-letter table."
    }
  ],
  "open_questions": [
    "What is the realistic peak concurrent usage?"
  ],
  "complexity": {
    "rating": "M",
    "time_estimate": "1-2 weeks to first working slice",
    "key_drivers": [
      "Hardening QR Resolver",
      "Async orchestration"
    ]
  },
  "constraints": [
    "Entities Exhibit, Track, Visit must persist relationally",
    "Components: QR Resolver, Track Streamer, Visit Analytics (privacy-first)"
  ]
}
