{
  "system_overview": "game-leaderboard-api is a low-latency leaderboard API for an indie game with anti-cheat. It is built as a small focused system with Score Validator (HMAC) at its core, supported by Ranking Store (Redis) and Season Roller.",
  "recommended_language": {
    "language": "Go",
    "confidence": "medium",
    "rationale": "Go fits the low-latency leaderboard API for an indie game with anti-cheat workload on technical grounds.",
    "overridden_by_user": false
  },
  "quality_goals": [
    {
      "goal": "Correct output under normal failure modes",
      "driver": "core feature correctness"
    },
    {
      "goal": "Maintainable by one person",
      "driver": "solo team size"
    }
  ],
  "architecture_decisions": [
    {
      "title": "Use Score Validator (HMAC) as the system core",
      "chosen_option": "Score Validator (HMAC)",
      "confidence": "high",
      "rationale": "The low-latency leaderboard API for an indie game with anti-cheat hinges on this component working well.",
      "consequences": {
        "positive": [
          "Single place to harden the critical path"
        ],
        "negative": [
          "Core component becomes a bottleneck for change"
        ]
      },
      "ruled_out": [
        {
          "option": "Spreading the logic across services",
          "rejection_reason": "Operational overhead for a small system."
        }
      ]
    },
    {
      "title": "Run Season Roller asynchronously",
      "chosen_option": "Background processing for Season Roller",
      "confidence": "medium",
      "rationale": "Keeps the interactive path fast on modest hardware.",
      "consequences": {
        "positive": [
          "Responsive UI under load"
        ],
        "negative": [
          "Eventually-consistent side effects need messaging"
        ]
      },
      "ruled_out": [
        {
          "option": "Synchronous in-request processing",
          "rejection_reason": "Ties user latency to slow external work."
        }
      ]
    }
  ],
  "oss_components": [
    {
      "name": "SQLite",
      "version": "3.45",
      "purpose": "primary store",
      "why_selected": "single-node scale, zero ops",
      "do_not_build": true
    }
  ],
  "what_not_to_build": [
    "A custom database or queue",
    "A plugin system before there are users"
  ],
  "risk_flags": [
    {
      "risk": "External dependency outage stalls the async path",
      "severity": "medium",
      "mitigation": "Retry with backoff and a dead-letter table."
    }
  ],
  "open_questions": [
    "What is the realistic peak concurrent usage?"
  ],
  "complexity": {
    "rating": "M",
    "time_estimate": "1-2 weeks to first working slice",
    "key_drivers": [
      "Hardening Score Validator (HMAC)",
      "Async orchestration"
    ]
  },
  "constraints": [
    "Entities Player, Score, Season must persist relationally",
    "Components: Score Validator (HMAC), Ranking Store (Redis), Season Roller"
  ]
}
