{
  "system_overview": "ecommerce-returns is a self-serve returns portal with label generation and refunds. It is built as a small focused system with Return Wizard at its core, supported by Label Service (EasyPost) and Refund Orchestrator.",
  "recommended_language": {
    "language": "TypeScript",
    "confidence": "medium",
    "rationale": "TypeScript fits the self-serve returns portal with label generation and refunds workload on technical grounds.",
    "overridden_by_user": false
  },
  "quality_goals": [
    {
      "goal": "Correct output under normal failure modes",
      "driver": "core feature correctness"
    },
    {
      "goal": "Maintainable by one person",
      "driver": "solo team size"
    }
  ],
  "architecture_decisions": [
    {
      "title": "Use Return Wizard as the system core",
      "chosen_option": "Return Wizard",
      "confidence": "high",
      "rationale": "The self-serve returns portal with label generation and refunds hinges on this component working well.",
      "consequences": {
        "positive": [
          "Single place to harden the critical path"
        ],
        "negative": [
          "Core component becomes a bottleneck for change"
        ]
      },
      "ruled_out": [
        {
          "option": "Spreading the logic across services",
          "rejection_reason": "Operational overhead for a small system."
        }
      ]
    },
    {
      "title": "Run Refund Orchestrator asynchronously",
      "chosen_option": "Background processing for Refund Orchestrator",
      "confidence": "medium",
      "rationale": "Keeps the interactive path fast on modest hardware.",
      "consequences": {
        "positive": [
          "Responsive UI under load"
        ],
        "negative": [
          "Eventually-consistent side effects need messaging"
        ]
      },
      "ruled_out": [
        {
          "option": "Synchronous in-request processing",
          "rejection_reason": "Ties user latency to slow external work."
        }
      ]
    }
  ],
  "oss_components": [
    {
      "name": "SQLite",
      "version": "3.45",
      "purpose": "primary store",
      "why_selected": "single-node scale, zero ops",
      "do_not_build": true
    }
  ],
  "what_not_to_build": [
    "A custom database or queue",
    "A plugin system before there are users"
  ],
  "risk_flags": [
    {
      "risk": "External dependency outage stalls the async path",
      "severity": "medium",
      "mitigation": "Retry with backoff and a dead-letter table."
    }
  ],
  "open_questions": [
    "What is the realistic peak concurrent usage?"
  ],
  "complexity": {
    "rating": "M",
    "time_estimate": "1-2 weeks to first working slice",
    "key_drivers": [
      "Hardening Return Wizard",
      "Async orchestration"
    ]
  },
  "constraints": [
    "Entities Order, ReturnCase, Label must persist relationally",
    "Components: Return Wizard, Label Service (EasyPost), Refund Orchestrator"
  ]
}
